{
  "$meta": {
    "name": "Construct visual tokens",
    "version": "0.1.0",
    "phase": "Phase 2 — UI foundations only",
    "summary": "Reconciled visual primitives for the Moderne CLI. Colors are semantic (never decorative). Typography has four roles. Glyphs are paired with color to reinforce meaning. Every token traces back to evidence in audit/ or context/. Behavioral / API tokens are deliberately absent.",
    "scope": "Visual layer only. No exit codes, output contracts, or framework heuristics. See reconciliation.md for the per-token derivation and gaps.md Part B for what is intentionally not tokenized here.",
    "evidence_keys": {
      "audit": "audit/cli-inventory.md surface IDs (e.g. ERR-002, BAN-002), and audit/cli-deltas.md / cli-categorized.md references.",
      "context": "context/cli-help-text-rewrites.pdf (Annie Rimbach), context/error-states-ui-uplift.pdf (Jayd Jackson), context/cli-help-text-journey-map.partial.html (CSS color tokens are authoritative)."
    }
  },

  "color": {
    "$description": "Semantic color tokens. Every color encodes a meaning; no token is decorative. Source values come from the journey-map CSS terminal classes (.t-cyan, .t-green, etc.). Single yellow token is shared across six expressions per D-03; disambiguation is by glyph + leading word + position, not by additional color.",

    "background": {
      "page": {
        "value": "#0F172A",
        "role": "Outer page background in mockups. Not emitted by the CLI itself; used in design surfaces only.",
        "evidence": ["context/cli-help-text-journey-map.partial.html — body class"]
      },
      "terminal": {
        "value": "#020617",
        "role": "Terminal frame background. Emitted by the host terminal, not by the CLI; documented so design mockups can match the rendering target.",
        "evidence": ["context/cli-help-text-journey-map.partial.html — .terminal class"]
      },
      "panel": {
        "value": "#334155",
        "role": "Box / chrome border in mockups. Not emitted by the CLI.",
        "evidence": ["context/cli-help-text-journey-map.partial.html — .border class"]
      }
    },

    "text": {
      "primary": {
        "value": "#f8fafc",
        "role": "Section headers, banners, default emphasis. Bold weight where used.",
        "applies_to": ["Section headers (USAGE / WHAT WENT WRONG / TRY / FLAGS / EXAMPLES)", "Close banners (MOD SUCCEEDED / MOD FAILED / MOD PARTIALLY SUCCEEDED — color overrides for state)", "Banner name + version line (BAN-001)"],
        "evidence": ["context/cli-help-text-journey-map.partial.html — .t-bold / .t-header", "audit BAN-001 / BAN-002 / BAN-003 / BAN-004 / BAN-005"]
      },
      "body": {
        "value": "#e2e8f0",
        "role": "Default reading text. Body of error WHAT WENT WRONG, body of help-text prose, success and partial-success body lines.",
        "applies_to": ["WHAT WENT WRONG body line", "Help-screen consequence prose", "EXAMPLES body lines (excluding the leading $ prompt)", "Sub-task success body following ✓"],
        "evidence": ["context/cli-help-text-journey-map.partial.html — .t-white", "context/error-states-ui-uplift.pdf — Jayd full-template cards (build/study/git sync)", "context/cli-help-text-rewrites.pdf — Annie leaf-command help screens"]
      },
      "supporting": {
        "value": "#94a3b8",
        "role": "Glosses, descriptions, paragraph prose under section headers, placeholder values inside cyan commands, child lines beneath onboarding steps.",
        "applies_to": ["Description text under section headers", "└ child lines under numbered onboarding steps", "Placeholders inside commands (e.g. <path>, <recipe-name>, <tenant-url>)", "Descriptions in NEXT STEP / WHAT TO DO NEXT bullets after the em-dash", "Empty-state lines (no glyph)"],
        "evidence": ["context/cli-help-text-journey-map.partial.html — .t-dim", "context/cli-help-text-rewrites.pdf — top-level mod onboarding, mod config -h descriptions"]
      },
      "metadata": {
        "value": "#64748b",
        "role": "Demoted / footer / gutter content. Used to recede content the user should see but not focus on.",
        "applies_to": ["Demoted support line in error TRY block (D-10) when other suggestions are present", "$ shell prompt prefix in EXAMPLES", "Demoted deprecated flags in help text (J)", "TECHNICAL DETAILS section (D-09 extrapolation) — when stack trace appears in user-facing template"],
        "evidence": ["context/cli-help-text-journey-map.partial.html — .t-gray", "context/error-states-ui-uplift.pdf — Jayd's demoted 'Still stuck? Report to support@moderne.io' line", "audit D-10"]
      }
    },

    "semantic": {
      "info": {
        "value": "#67e8f9",
        "name": "cyan",
        "role": "Runnable commands, inline command references, hyperlinks, [incubating] tag. Cyan signals 'this is interactive content the user can type or click'.",
        "applies_to": ["Inline command references in prose (replaces bold per D-12)", "Inline flag references", "Inline path references", "Hyperlinked content (OSC-8 wrapped — log paths, support email, dashboard URLs, repo paths, data-table paths) per Q", "[incubating] tag in help (K)", "Numbered onboarding step commands (1–9 in Annie's top-level mod)", "▶ recovery / next-step command bodies"],
        "evidence": ["context/cli-help-text-journey-map.partial.html — .t-cyan", "audit D-12 (inline references), audit D-15 (hyperlinks), audit category Q"]
      },
      "success": {
        "value": "#4ade80",
        "name": "green",
        "role": "Success state. Used on the close banner and on inline ✓ glyphs only — never on body text or commands.",
        "applies_to": ["MOD SUCCEEDED close banner phrase (BAN-002)", "MOD SUCCEEDED WITH WARNINGS — text after the warning marker is body color, but the SUCCEEDED token can render in green where the framework distinguishes the two states", "Inline ✓ glyph (SUC-001)", "Numbered step indices (1–9) in onboarding ladder"],
        "evidence": ["context/cli-help-text-journey-map.partial.html — .t-green", "audit BAN-002, SUC-001", "context/cli-help-text-rewrites.pdf — top-level mod numbered ladder"]
      },
      "danger": {
        "value": "#f87171",
        "name": "red",
        "role": "Error / failure. Used on the failure preface, the close banner phrase, the ● bullet on error sections (WHAT WENT WRONG, TRY), and on the inline ! Error: marker.",
        "applies_to": ["FAILURE: preface (ERR-002)", "MOD FAILED close banner (BAN-004 failure variant)", "● bullet on WHAT WENT WRONG and TRY section headers", "! Error: inline marker in compact / usage error tier", "✗ row glyph in tables when status is failure"],
        "evidence": ["context/cli-help-text-journey-map.partial.html — .t-red", "context/error-states-ui-uplift.pdf — full-template error frames", "audit ERR-002, BAN-004"]
      },
      "warning": {
        "value": "#fbbf24",
        "name": "yellow",
        "role": "Single yellow token covering six expressions per D-03. Disambiguation is by glyph + leading word + position, not by color subdivision.",
        "applies_to": ["Inline ⚠ warning glyph (WARN-001)", "? Hint: inline tag", "! Note: inline tag", "WARNING: deprecation banner (BAN-005)", "WARNING: success-with-warnings banner (BAN-003)", "PARTIAL SUCCESS: preface (BAN-004 partial variant) + MOD PARTIALLY SUCCEEDED close phrase"],
        "evidence": ["context/cli-help-text-journey-map.partial.html — .t-yellow", "context/error-states-ui-uplift.pdf — Jayd's mod search frame (⚠ + ? Hint + recovery)", "context/cli-help-text-rewrites.pdf — Annie's ? Hint and ! Note inline tags", "audit D-03, WARN-001, BAN-003, BAN-004, BAN-005"]
      }
    },

    "fallback": {
      "$description": "Color fallbacks per S. Cascade is 24-bit truecolor → xterm-256 → no color. NO_COLOR=1 honored. Glyph + leading word + position must carry semantic when color is absent — every codified pattern must read in NO_COLOR + ASCII-only mode.",
      "truecolor": "Use the hex values above directly (24-bit ANSI escape).",
      "xterm_256": "Approximate to the nearest xterm-256 index. (Indices are framework-determined; visual system does not pin them.)",
      "no_color": "Emit no color escapes. Glyph + leading word + position carry the semantic. Banner phrases (MOD SUCCEEDED / MOD FAILED) remain bold; sectionizer characters (●, ▶, ✓, ⚠, ?, !) print as ASCII fallbacks per the glyph table."
    }
  },

  "typography": {
    "$description": "Four typography roles, distinguishable by weight + color. Section headers use slight letter-spacing (0.02em in mockups) to differentiate ALL-CAPS from inline emphasis.",

    "section_header": {
      "weight": 700,
      "case": "ALL CAPS",
      "letter_spacing": "0.02em (mockup-only; terminals don't render letter-spacing — the casing carries the visual delta)",
      "color": "color.text.primary (or color.semantic.danger when prefixed by ● in error sections — the bullet is colored, the header text remains primary white)",
      "underline": false,
      "applies_to": ["USAGE", "GET STARTED", "CONFIGURE YOUR ENVIRONMENT", "SETUP / AUTO-CONFIGURED / OPTIONAL", "RUN RECIPES", "ARGUMENTS", "FLAGS", "EXAMPLES", "NEXT STEP", "LEARN MORE", "WHAT WENT WRONG", "TRY", "WHAT TO DO NEXT", "TECHNICAL DETAILS"],
      "supersedes": "picocli's bold + underlined section headers (HELP-001). Underline is dropped per category I.",
      "evidence": ["context/cli-help-text-rewrites.pdf — every help screen", "context/error-states-ui-uplift.pdf — every full-template error frame", "audit HELP-001, D-17"]
    },

    "primary": {
      "weight": "regular (bold for banner phrases only)",
      "color": "color.text.body",
      "role": "Default reading text. Body of WHAT WENT WRONG, body of help-text consequence prose, success and partial-success body lines, the body of EXAMPLES (excluding the leading $ prompt).",
      "evidence": ["context/error-states-ui-uplift.pdf", "context/cli-help-text-rewrites.pdf"]
    },